<?xml version="1.0"?>
<?xml-stylesheet type="text/xsl" href="cv.xsl"?>
<!DOCTYPE cave SYSTEM "cv.dtd">
<cv>

	<identite>
		<nom>LaCaille</nom>
		<prenom>Landers</prenom>
		<photo>images/icon4.jpg</photo>
	</identite>

	<mail>medecing4@gmail.com</mail>
	<telephone>06 11 11 11 04</telephone>
	<specialite>Généraliste</specialite>

	<experiences>
		<experience>
			<date>2016</date>
			<etablissement>Omnes Santé</etablissement>
		</experience>
		<experience>
			<date>2014</date>
			<etablissement>Polyclinique de Nantes</etablissement>
		</experience>
	</experiences>

	<formations>
		<formation>
			<date>2013</date>
			<diplome>Diplôme d'Etat de Docteur en Médecine</diplome>
			<etablissement> UFR Médecine de Nantes</etablissement>
		</formation>
		<formation>
			<date>2004</date>
			<diplome>Baccalauréat Scientifique</diplome>
			<etablissement>Lycée Victor Hugo Nantes</etablissement>
		</formation>
	</formations>

	<competences>
		<competence>Formateur</competence>
		<competence>A l'écoute</competence>
	</competences>

</cv>
