<?xml version="1.0"?>
<?xml-stylesheet type="text/xsl" href="cv.xsl"?>
<!DOCTYPE cave SYSTEM "cv.dtd">
<cv>

	<identite>
		<nom>Roussel</nom>
		<prenom>Raina</prenom>
		<photo>images/icon6.jpg</photo>
	</identite>

	<mail>servenceinte@gmail.com</mail>
	<telephone>06 33 33 33 03</telephone>
	<specialite>Biologie de la femme enceinte</specialite>

	<experiences>
		<experience>
			<date>2017</date>
			<etablissement>Omnes Santé</etablissement>
		</experience>
		<experience>
			<date>2012</date>
			<etablissement>Clnique La Mitterie Lomme</etablissement>
		</experience>
	</experiences>

	<formations>
		<formation>
			<date>2012</date>
			<diplome>Diplôme d'Etat de Docteur en Médecine</diplome>
			<etablissement> UFR Médecine de Rennes</etablissement>
		</formation>
		<formation>
			<date>2004</date>
			<diplome>Baccalauréat Scientifique</diplome>
			<etablissement>Lycée Eugène Delacroix Rennes</etablissement>
		</formation>
	</formations>

	<competences>
		<competence>Formateur</competence>
		<competence>Bonne communication</competence>
	</competences>

</cv>
