<?xml version="1.0"?>
<?xml-stylesheet type="text/xsl" href="cv.xsl"?>
<!DOCTYPE cave SYSTEM "cv.dtd">
<cv>

	<identite>
		<nom>Tougas</nom>
		<prenom>Raoul</prenom>
		<photo>images/icon7.jpg</photo>
	</identite>

	<mail>servroutine@gmail.com</mail>
	<telephone>06 33 33 33 04</telephone>
	<specialite>Biologie de la routine</specialite>

	<experiences>
		<experience>
			<date>2020</date>
			<etablissement>Omnes Santé</etablissement>
		</experience>
		<experience>
			<date>2016</date>
			<etablissement>Hôpital Maritime de Zuydcoote</etablissement>
		</experience>
		<experience>
			<date>2010</date>
			<etablissement>Centre Hospitalier de Valenciennes</etablissement>
		</experience>
	</experiences>

	<formations>
		<formation>
			<date>2010</date>
			<diplome>Diplôme d'Etat de Docteur en Médecine</diplome>
			<etablissement> UFR Médecine de Lille</etablissement>
		</formation>
		<formation>
			<date>2000</date>
			<diplome>Baccalauréat Scientifique</diplome>
			<etablissement>Lycée Carnot Valenciennes</etablissement>
		</formation>
	</formations>

	<competences>
		<competence>Formateur</competence>
		<competence>A l'écoute</competence>
	</competences>

</cv>
