<?xml version="1.0"?>
<?xml-stylesheet type="text/xsl" href="cv.xsl"?>
<!DOCTYPE cave SYSTEM "cv.dtd">
<cv>

	<identite>
		<nom>Aubé</nom>
		<prenom>Alphonse</prenom>
		<photo>images/icon1.jpg</photo>
	</identite>

	<mail>medist2@gmail.com</mail>
	<telephone>06 22 22 22 14</telephone>
	<specialite>IST</specialite>

	<experiences>
		<experience>
			<date>2017</date>
			<etablissement>Omnes Santé</etablissement>
		</experience>
		<experience>
			<date>2012</date>
			<etablissement>Clnique La Mitterie Lomme</etablissement>
		</experience>
	</experiences>

	<formations>
		<formation>
			<date>2012</date>
			<diplome>Diplôme d'Etat de Docteur en Médecine</diplome>
			<etablissement> UFR Médecine de Rennes</etablissement>
		</formation>
		<formation>
			<date>2004</date>
			<diplome>Baccalauréat Scientifique</diplome>
			<etablissement>Lycée Eugène Delacroix Rennes</etablissement>
		</formation>
	</formations>

	<competences>
		<competence>Formateur</competence>
		<competence>Bonne communication</competence>
	</competences>

</cv>
